author,author_fullname,body,created_utc,id,parent_id,permalink,score,subreddit
attila954,t2_t7316yu,"Congrats, 1mil in 2 years is really impressed",1631622732,hct946k,t3_pnnmzn,/r/wallstreetbets/comments/pnnmzn/2_years_ago_i_yolod_my_entire_life_savings_into/hct946k/,1,wallstreetbets
rearviewviewer,t2_xx1wz,Extremely gay,1631622732,hct9479,t3_po14xi,/r/wallstreetbets/comments/po14xi/this_dude_trying_to_pick_up_a_girl_with_his_wells/hct9479/,0,wallstreetbets
Lolsmileyface13,t2_kumq8,As is tradition. Made me lol,1631622733,hct948r,t1_hct924n,/r/wallstreetbets/comments/pnzrg1/daily_discussion_thread_for_september_14_2021/hct948r/,3,wallstreetbets
StrikePrice,t2_6ewbb,"We need new monetary theory that does not immediately reject the notion that unlimited printing of money cannot work. I never believed it could. But so far, it has.",1631622735,hct94fj,t3_po0x6u,/r/wallstreetbets/comments/po0x6u/most_of_you_clearly_dont_understand_how_a_mark/hct94fj/,35,wallstreetbets
enterdoki,t2_q3wb5ub,Transitory!,1631622735,hct94fp,t3_pnzrg1,/r/wallstreetbets/comments/pnzrg1/daily_discussion_thread_for_september_14_2021/hct94fp/,5,wallstreetbets
elonhole,t2_5u7dne9c,"5.3% instead of 5.4% inflation year over year

WE DID IT REDDIT, WE BEAT INFLATION",1631622739,hct94nu,t3_pnzrg1,/r/wallstreetbets/comments/pnzrg1/daily_discussion_thread_for_september_14_2021/hct94nu/,12,wallstreetbets
cantadmittoposting,t2_my4e7,Mooning wen,1631622740,hct94qa,t1_hct917q,/r/wallstreetbets/comments/pnzrg1/daily_discussion_thread_for_september_14_2021/hct94qa/,1,wallstreetbets
Qwisatz,t2_76hod,Inflation literally cancelled ATH EOD,1631622741,hct94t8,t3_pnzrg1,/r/wallstreetbets/comments/pnzrg1/daily_discussion_thread_for_september_14_2021/hct94t8/,6,wallstreetbets
zparisa,t2_1xaat01f,SDC looking ripe for takeoff. 🚀🚀,1631622742,hct94u8,t3_pnzrg1,/r/wallstreetbets/comments/pnzrg1/daily_discussion_thread_for_september_14_2021/hct94u8/,0,wallstreetbets
Cal4mity,t2_ygy8pdm,This shit is getting old bro... Just go up....,1631622743,hct94xk,t1_hct8vlo,/r/wallstreetbets/comments/pnzrg1/daily_discussion_thread_for_september_14_2021/hct94xk/,1,wallstreetbets
LostLifeSavingsOnGME,t2_9nailic9,People holding puts 🤡 clown 🤡,1631622745,hct952q,t3_pnzrg1,/r/wallstreetbets/comments/pnzrg1/daily_discussion_thread_for_september_14_2021/hct952q/,6,wallstreetbets
LeozMJilliumz,t2_7m5i5wqx,"Oh hell yea, this will go great in more portfolio right under the ornamental gourds ticker!",1631622745,hct953t,t3_po1o84,/r/wallstreetbets/comments/po1o84/rice_squeeze_america_wins_if_china_starves/hct953t/,26,wallstreetbets
VisualMod,t2_6hf2z55l,I am a bot from /r/wallstreetbets. Your submission was removed because was too short. Please make it a comment if it's not worth expounding on.,1631622746,hct954r,t3_po1u5h,/r/wallstreetbets/comments/po1u5h/is_wish_the_next_gmeamc/hct954r/,1,wallstreetbets
thelundyy,t2_37ohhce3,Allow us to remember the shit talking from bulls when spy tanks at open per usual.,1631622747,hct958a,t3_pnzrg1,/r/wallstreetbets/comments/pnzrg1/daily_discussion_thread_for_september_14_2021/hct958a/,5,wallstreetbets
mMounirM,t2_fqml8,now I can enjoy my day,1631622748,hct95b8,t3_pnzrg1,/r/wallstreetbets/comments/pnzrg1/daily_discussion_thread_for_september_14_2021/hct95b8/,3,wallstreetbets
BullfrogBrewing,t2_iyt150x,Lmfao .1% beat,1631622753,hct95ku,t3_pnzrg1,/r/wallstreetbets/comments/pnzrg1/daily_discussion_thread_for_september_14_2021/hct95ku/,6,wallstreetbets
[deleted],,[removed],1631622754,hct95n8,t3_pnzrg1,/r/wallstreetbets/comments/pnzrg1/daily_discussion_thread_for_september_14_2021/hct95n8/,1,wallstreetbets
jon-mcman,t2_7lagjkja,"I mean its either this, Or they actually raise interest rates and then we get something close to, but not as bad as, the 2008 scenario over again.",1631622754,hct95no,t1_hcrlj2c,/r/wallstreetbets/comments/pnelsm/its_a_lot_worse_than_you_think/hct95no/,1,wallstreetbets
EatMaTesticles,t2_kav2g,TSLA $800 eod 🚀,1631622754,hct95o3,t3_pnzrg1,/r/wallstreetbets/comments/pnzrg1/daily_discussion_thread_for_september_14_2021/hct95o3/,3,wallstreetbets
Elonmuskishuman,t2_70ddecoo,Inflation truly is transitory,1631622755,hct95ow,t3_pnzrg1,/r/wallstreetbets/comments/pnzrg1/daily_discussion_thread_for_september_14_2021/hct95ow/,8,wallstreetbets
furrypurpledinosaur,t2_jve6l,"Alright, back to SPY calls it is.",1631622755,hct95qa,t3_pnzrg1,/r/wallstreetbets/comments/pnzrg1/daily_discussion_thread_for_september_14_2021/hct95qa/,7,wallstreetbets
mingling4502,t2_78ybx,🏳️‍🌈🐻💀 as always,1631622756,hct95r9,t3_pnzrg1,/r/wallstreetbets/comments/pnzrg1/daily_discussion_thread_for_september_14_2021/hct95r9/,4,wallstreetbets
AppyWappy,t2_22po28,Consumer price index rises 5.3% year over year in August vs 5.4% estimate,1631622757,hct95vd,t3_pnzrg1,/r/wallstreetbets/comments/pnzrg1/daily_discussion_thread_for_september_14_2021/hct95vd/,8,wallstreetbets
lolyouseriousbro,t2_6ebwmo9,imagine being a gay bear in this market,1631622761,hct965h,t3_pnzrg1,/r/wallstreetbets/comments/pnzrg1/daily_discussion_thread_for_september_14_2021/hct965h/,6,wallstreetbets
iv2892,t2_5b0a37kn,"We are staying bullish or at the very worst flat for the one more month . No crash , sorry bears",1631622762,hct9664,t3_pnzrg1,/r/wallstreetbets/comments/pnzrg1/daily_discussion_thread_for_september_14_2021/hct9664/,6,wallstreetbets
account_not_active,t2_soomi,sell the news folks,1631622762,hct967m,t3_pnzrg1,/r/wallstreetbets/comments/pnzrg1/daily_discussion_thread_for_september_14_2021/hct967m/,3,wallstreetbets
MaddiKertz,t2_7shjnwaa,We good dudes. Fire up the rocketship!!,1631622762,hct967q,t3_pnzrg1,/r/wallstreetbets/comments/pnzrg1/daily_discussion_thread_for_september_14_2021/hct967q/,4,wallstreetbets
GammaHz,t2_bvkah7t4,Fair,1631622762,hct9682,t1_hct8tzx,/r/wallstreetbets/comments/pnzrg1/daily_discussion_thread_for_september_14_2021/hct9682/,2,wallstreetbets
cashflow_,t2_527ci52f,My puts r fuk 🥺,1631622762,hct968q,t3_pnzrg1,/r/wallstreetbets/comments/pnzrg1/daily_discussion_thread_for_september_14_2021/hct968q/,14,wallstreetbets
Redghors,t2_11nce4,Youve just been promoted to CEO of Apple,1631622763,hct96a2,t1_hct8lv9,/r/wallstreetbets/comments/po14xi/this_dude_trying_to_pick_up_a_girl_with_his_wells/hct96a2/,16,wallstreetbets
Clawkwork,t2_c31ys,Ber extinction event.,1631622763,hct96at,t3_pnzrg1,/r/wallstreetbets/comments/pnzrg1/daily_discussion_thread_for_september_14_2021/hct96at/,8,wallstreetbets
vORP,t2_5r0oa,"Welp, good talk hope you didn't have puts!",1631622765,hct96et,t1_hcrw599,/r/wallstreetbets/comments/pnn4wa/what_are_your_moves_tomorrow_september_14_2021/hct96et/,1,wallstreetbets
baddad49,t2_bp2ynox6,its coming...eventually,1631622766,hct96hb,t1_hct3oe1,/r/wallstreetbets/comments/pnzrg1/daily_discussion_thread_for_september_14_2021/hct96hb/,1,wallstreetbets
hairlongmoneylong,t2_anhg8,Fr tho. I judge everyone who still uses Wells Fargo.,1631622767,hct96l1,t1_hct5eok,/r/wallstreetbets/comments/po14xi/this_dude_trying_to_pick_up_a_girl_with_his_wells/hct96l1/,4,wallstreetbets
AmbitiousSkirt2,t2_696iny1n,Seriously no joke whenever it’s extremely bearish in the daily that is the biggest indicator to buy spy calls easy money everytime,1631622770,hct96s2,t3_pnzrg1,/r/wallstreetbets/comments/pnzrg1/daily_discussion_thread_for_september_14_2021/hct96s2/,7,wallstreetbets
SanFranJon,t2_a3y1akc,Thank you man,1631622770,hct96sc,t1_hcs9qek,/r/wallstreetbets/comments/pnnv61/25035_to_56793_in_43_minutes_with_spy_0dte_446c/hct96sc/,2,wallstreetbets
down_vote_magnet,t2_4vqe3,"You and the guy you’re arguing with are both missing what he said.

The end of the video he says “I made £2,800…” and then it cuts off. I’m guessing he’s about to reel off his latest trading profit or something.",1631622772,hct96x2,t1_hct72hw,/r/wallstreetbets/comments/po14xi/this_dude_trying_to_pick_up_a_girl_with_his_wells/hct96x2/,1,wallstreetbets
[deleted],,[removed],1631622772,hct96xr,t3_pnn4wa,/r/wallstreetbets/comments/pnn4wa/what_are_your_moves_tomorrow_september_14_2021/hct96xr/,1,wallstreetbets
[deleted],,[removed],1631622774,hct970x,t3_pnzrg1,/r/wallstreetbets/comments/pnzrg1/daily_discussion_thread_for_september_14_2021/hct970x/,1,wallstreetbets
777FADEC,t2_6nguypb,"What are these pussy ass micro moves. I miss the days of 1% moves, sick and tired of these .2% or less moves.",1631622774,hct9721,t3_pnzrg1,/r/wallstreetbets/comments/pnzrg1/daily_discussion_thread_for_september_14_2021/hct9721/,1,wallstreetbets
Elonmuskishuman,t2_70ddecoo,The show goes on boys!! 🚀🚀,1631622776,hct977r,t3_pnzrg1,/r/wallstreetbets/comments/pnzrg1/daily_discussion_thread_for_september_14_2021/hct977r/,3,wallstreetbets
ninkorn,t2_3oskv4er,"Somebody call Billy Joe Armstrong

Because it's going to be **GREEN DAY**",1631622778,hct97ad,t3_pnzrg1,/r/wallstreetbets/comments/pnzrg1/daily_discussion_thread_for_september_14_2021/hct97ad/,5,wallstreetbets
Telkorenar,t2_1dt6f9w9,ber market cancelled.  new ATH's inbound!,1631622779,hct97ew,t3_pnzrg1,/r/wallstreetbets/comments/pnzrg1/daily_discussion_thread_for_september_14_2021/hct97ew/,4,wallstreetbets
eternalrefuge86,t2_19mglo33,Well boys looks like my SPY calls may print after all! SPY 451 EOD confirmed,1631622781,hct97ix,t3_pnzrg1,/r/wallstreetbets/comments/pnzrg1/daily_discussion_thread_for_september_14_2021/hct97ix/,7,wallstreetbets
hullaballoonist,t2_brn2s,they're like letters but they represent how many apples Syed is holding,1631622782,hct97jl,t1_hct8zry,/r/wallstreetbets/comments/pnzrg1/daily_discussion_thread_for_september_14_2021/hct97jl/,2,wallstreetbets
Jonhung,t2_a2thw9rv,Recession's over. Time for a new high SPY,1631622782,hct97l2,t3_pnzrg1,/r/wallstreetbets/comments/pnzrg1/daily_discussion_thread_for_september_14_2021/hct97l2/,11,wallstreetbets
HaHawk,t2_ghqye,"""heuristically adjusted""",1631622783,hct97lt,t1_hct8qjr,/r/wallstreetbets/comments/pnzrg1/daily_discussion_thread_for_september_14_2021/hct97lt/,1,wallstreetbets
Pilttipoika,t2_ydssf,"Rip bers, time for my calls to come back to life",1631622783,hct97mm,t3_pnzrg1,/r/wallstreetbets/comments/pnzrg1/daily_discussion_thread_for_september_14_2021/hct97mm/,9,wallstreetbets
gonewildpapi,t2_5yi97luo,Bears get ready to eat shit as usual,1631622783,hct97mn,t3_pnzrg1,/r/wallstreetbets/comments/pnzrg1/daily_discussion_thread_for_september_14_2021/hct97mn/,9,wallstreetbets
WrongYak34,t2_7mfzplov,"Why would you even have 92,000$ in a chequing account it’s pointless really",1631622784,hct97qf,t3_po14xi,/r/wallstreetbets/comments/po14xi/this_dude_trying_to_pick_up_a_girl_with_his_wells/hct97qf/,21,wallstreetbets
Gaston44,t2_6chlv,Maybe tech finally goes up today,1631622787,hct97wo,t3_pnzrg1,/r/wallstreetbets/comments/pnzrg1/daily_discussion_thread_for_september_14_2021/hct97wo/,3,wallstreetbets
meta-cognizant,t2_i56pq,That candle lmao,1631622789,hct9818,t3_pnzrg1,/r/wallstreetbets/comments/pnzrg1/daily_discussion_thread_for_september_14_2021/hct9818/,5,wallstreetbets
rubbarz,t2_age4g,"The fact he has Wells Fargo leads me to believe this is an insurance claim from his construction site he works at. 

Nobody with money willingly get a Wells Fargo account.",1631622790,hct982t,t1_hct54oe,/r/wallstreetbets/comments/po14xi/this_dude_trying_to_pick_up_a_girl_with_his_wells/hct982t/,223,wallstreetbets
bmault,t2_7v9hd,thanks I will read more into it.,1631622791,hct985y,t1_hct82xr,/r/wallstreetbets/comments/pnzrg1/daily_discussion_thread_for_september_14_2021/hct985y/,1,wallstreetbets
SingleVitamin,t2_cselmk8r,Data is gud booisss,1631622792,hct986p,t3_pnzrg1,/r/wallstreetbets/comments/pnzrg1/daily_discussion_thread_for_september_14_2021/hct986p/,6,wallstreetbets
spinxter66,t2_51kp4qjk,#BAAAAAHAAAAAAHAAAAAA 🤣,1631622793,hct989j,t3_pnzrg1,/r/wallstreetbets/comments/pnzrg1/daily_discussion_thread_for_september_14_2021/hct989j/,5,wallstreetbets
acab520ac,t2_6mssn1wd,"Dude .... why do you use the Word ""Gay"" as an insult? Think bout it. Its not right to do this .",1631622793,hct989y,t1_hct9479,/r/wallstreetbets/comments/po14xi/this_dude_trying_to_pick_up_a_girl_with_his_wells/hct989y/,-2,wallstreetbets
[deleted],,[removed],1631622793,hct98an,t1_hct7s9b,/r/wallstreetbets/comments/pnzrg1/daily_discussion_thread_for_september_14_2021/hct98an/,1,wallstreetbets
AutoModerator,t2_6l4z3,"Your submission was removed from /r/wallstreetbets due to being too short. All text submissions must be at least 100 characters long.

*I am a bot, and this action was performed automatically. Please [contact the moderators of this subreddit](/message/compose/?to=/r/wallstreetbets) if you have any questions or concerns.*",1631622793,hct98ar,t3_po1v3a,/r/wallstreetbets/comments/po1v3a/thanks_a_lot_morgan_stanley_lcid_dont_recognize/hct98ar/,1,wallstreetbets
Whoopiskin,t2_bgi1w,Spit on me,1631622794,hct98cg,t1_hct8xru,/r/wallstreetbets/comments/pnzrg1/daily_discussion_thread_for_september_14_2021/hct98cg/,1,wallstreetbets
PostM8,t2_131hc3,F,1631622794,hct98dg,t1_hct968q,/r/wallstreetbets/comments/pnzrg1/daily_discussion_thread_for_september_14_2021/hct98dg/,3,wallstreetbets
bluecheezze,t2_9zml5bgw,Rough Rice.....that's right up there with Mandingo.,1631622797,hct98jw,t3_po1o84,/r/wallstreetbets/comments/po1o84/rice_squeeze_america_wins_if_china_starves/hct98jw/,3,wallstreetbets
[deleted],,[removed],1631622799,hct98pt,t1_hct8bds,/r/wallstreetbets/comments/pnzrg1/daily_discussion_thread_for_september_14_2021/hct98pt/,1,wallstreetbets
[deleted],,[removed],1631622800,hct98qs,t3_pnnmzn,/r/wallstreetbets/comments/pnnmzn/2_years_ago_i_yolod_my_entire_life_savings_into/hct98qs/,1,wallstreetbets
saw-it,t2_6ea0x,How many bers did spy just kill?,1631622800,hct98qu,t3_pnzrg1,/r/wallstreetbets/comments/pnzrg1/daily_discussion_thread_for_september_14_2021/hct98qu/,9,wallstreetbets
[deleted],,[removed],1631622801,hct98su,t1_hct92yw,/r/wallstreetbets/comments/pnzrg1/daily_discussion_thread_for_september_14_2021/hct98su/,1,wallstreetbets
Work_Owl,t2_img83,I don't think it'll do shit till Feb when they have a working Ivy demo,1631622801,hct98u6,t3_pnvnr9,/r/wallstreetbets/comments/pnvnr9/bb_technical_analysis_a_monstrous_rip_is_looming/hct98u6/,2,wallstreetbets
AutoModerator,t2_6l4z3,"News posts **must be market moving** and contain **new** information. Please avoid editorializing the title. 

If your post doesn't meet the requirements above, please delete the thread before a mod sees it.

*I am a bot, and this action was performed automatically. Please [contact the moderators of this subreddit](/message/compose/?to=/r/wallstreetbets) if you have any questions or concerns.*",1631622803,hct98xu,t3_po1v6y,/r/wallstreetbets/comments/po1v6y/cpi_increased_03_in_august_down_from_05_in_july/hct98xu/,0,wallstreetbets
CrackTotHekidZ,t2_uiqmevn,"If he wanted to get laid that bad, just go to an atm take $1k out and get yourself an hour with a Russian model that will suck your soul out of your dick. Save the embarrassment dude",1631622807,hct997d,t3_po14xi,/r/wallstreetbets/comments/po14xi/this_dude_trying_to_pick_up_a_girl_with_his_wells/hct997d/,27,wallstreetbets
Alien8w8,t2_2hxhapd9,"still waiting for how you got your price target too, but it's cool the internet is the place for claiming dumb shit with zero proof.

god speed ape",1631622808,hct999m,t1_hcseqtc,/r/wallstreetbets/comments/pndzcb/daily_popular_tickers_thread_for_september_13/hct999m/,1,wallstreetbets
VisualMod,t2_6hf2z55l,I am a bot from /r/wallstreetbets. Your submission was removed because was too short. Please make it a comment if it's not worth expounding on.,1631622808,hct99bh,t3_po1v3a,/r/wallstreetbets/comments/po1v3a/thanks_a_lot_morgan_stanley_lcid_dont_recognize/hct99bh/,1,wallstreetbets
AromaticFarmer,t2_3bk6cqry,Woo wooo roaring 20s LFG 🥂 Back to your musty cave beario 🤠,1631622810,hct99en,t3_pnzrg1,/r/wallstreetbets/comments/pnzrg1/daily_discussion_thread_for_september_14_2021/hct99en/,6,wallstreetbets
StonksInvesteur,t2_92xcxppg,RIP 🌈🐻,1631622814,hct99pu,t3_pnzrg1,/r/wallstreetbets/comments/pnzrg1/daily_discussion_thread_for_september_14_2021/hct99pu/,10,wallstreetbets
Snottywindow,t2_ixtmo,CPIie flat and gay as us usual.,1631622815,hct99su,t3_pnzrg1,/r/wallstreetbets/comments/pnzrg1/daily_discussion_thread_for_september_14_2021/hct99su/,2,wallstreetbets
[deleted],,[removed],1631622816,hct99th,t3_pnvnr9,/r/wallstreetbets/comments/pnvnr9/bb_technical_analysis_a_monstrous_rip_is_looming/hct99th/,1,wallstreetbets
Mountain-Language623,t2_cc49ghfi,Yeah as a holder I want to get rich off this,1631622816,hct99uw,t3_pnyso1,/r/wallstreetbets/comments/pnyso1/the_sprott_uranium_fund_is_a_self_reinforcing/hct99uw/,8,wallstreetbets
sch6808,t2_6veo9,My SPY calls are happy!,1631622816,hct99vn,t3_pnzrg1,/r/wallstreetbets/comments/pnzrg1/daily_discussion_thread_for_september_14_2021/hct99vn/,7,wallstreetbets
Adept_Chip,t2_5xrgxiba,"Nice job, superb overview with lots of reference resources. Thanks for your hard work!",1631622817,hct99wy,t3_pnvs1d,/r/wallstreetbets/comments/pnvs1d/microvisionapple_mention_on_cnbc/hct99wy/,5,wallstreetbets
Opposite_Engine_6776,t2_85zxyof2,So does this mean my rent will eventually go down? Or rent only goes 📈🚀?,1631622820,hct9a3t,t3_pnzrg1,/r/wallstreetbets/comments/pnzrg1/daily_discussion_thread_for_september_14_2021/hct9a3t/,7,wallstreetbets
hairlongmoneylong,t2_anhg8,BOOM.,1631622820,hct9a4f,t1_hct6jmt,/r/wallstreetbets/comments/po14xi/this_dude_trying_to_pick_up_a_girl_with_his_wells/hct9a4f/,37,wallstreetbets
Kingace__,t2_98cy0m63,Bullshit lol,1631622822,hct9aaf,t3_pnzrg1,/r/wallstreetbets/comments/pnzrg1/daily_discussion_thread_for_september_14_2021/hct9aaf/,2,wallstreetbets
[deleted],,[deleted],1631622824,hct9ae8,t3_pnzrg1,/r/wallstreetbets/comments/pnzrg1/daily_discussion_thread_for_september_14_2021/hct9ae8/,2,wallstreetbets
[deleted],,[removed],1631536312,hcoluj7,t3_pmzxa9,/r/wallstreetbets/comments/pmzxa9/what_are_your_moves_tomorrow_september_13_2021/hcoluj7/,1,wallstreetbets
upsidevalue,t2_b3jrw5m0,There were a couple of people hard posting earlier yesterday about their puts. I’m just curious to see how they’re doing right now.,1631536318,hcoluvl,t3_pncese,/r/wallstreetbets/comments/pncese/daily_discussion_thread_for_september_13_2021/hcoluvl/,2,wallstreetbets
Ready2gambleboomer,t2_5bqs1ir8,"I have an IPhone.  I don't know the technology, I just know it happens.  Maybe on the carriers (T-mobile) end?  Since it is detected as computer driven it lists as ""scam likely"".  If you answer you will hear the computer click on and begin to speak to you etc.",1631536320,hcolv16,t1_hcojngk,/r/wallstreetbets/comments/pmslsv/the_very_essence_of_rwallstreetbets/hcolv16/,1,wallstreetbets
SkinnyBoyObama,t2_5gvn8u3l,"Massive market manipulation. Just last week cowen (who has over 30,000 $7,50 puts opts) downed the stock claiming it was worth pennies after taking out a massive short position. Countless manipulation from various HF pushing the price down. Shit just reminds me of the early AMC/GME days. Only problem is there’s a lot of hate on wsb and a cult like opposition opposes and calls us retards even tho we were all on the same team months ago putting money into the dying entertainment company that is amc

Shits messy and I likey 🤑🤑🚀🚀🍀🍀",1631536324,hcolv9y,t3_pndzcb,/r/wallstreetbets/comments/pndzcb/daily_popular_tickers_thread_for_september_13/hcolv9y/,57,wallstreetbets
[deleted],,[removed],1631536324,hcolvbz,t3_pncese,/r/wallstreetbets/comments/pncese/daily_discussion_thread_for_september_13_2021/hcolvbz/,1,wallstreetbets
throwawaymyalias,t2_1t7n7zm1,"IFRX.

Go ahead and laugh - you'll see...!",1631536325,hcolvc3,t3_pndzcb,/r/wallstreetbets/comments/pndzcb/daily_popular_tickers_thread_for_september_13/hcolvc3/,-2,wallstreetbets
Unitedtendies,t2_8ziuyp95,CCj not holding $25 well,1631536325,hcolve0,t3_pncese,/r/wallstreetbets/comments/pncese/daily_discussion_thread_for_september_13_2021/hcolve0/,-5,wallstreetbets
BurnMuFuggaBurn,t2_a34jv8ox,We just updated the Menu and are now offering Cleveland Steamships!,1631536327,hcolvi2,t1_hcoksmc,/r/wallstreetbets/comments/pncese/daily_discussion_thread_for_september_13_2021/hcolvi2/,2,wallstreetbets
12MonthsinEstonian,t2_auo4pvnh,[on loop](https://old.reddit.com/r/wallstreetbets/comments/pmzxa9/what_are_your_moves_tomorrow_september_13_2021/hcmf98f/?context=3),1631536328,hcolvl3,t1_hcolkp0,/r/wallstreetbets/comments/pncese/daily_discussion_thread_for_september_13_2021/hcolvl3/,0,wallstreetbets
PrincPaco,t2_9u6p1i8x,"So many tickers already down 10%-20% from highs 3 months ago. Berz only hope of the correction they want to see is big tech dropping, and nobody rotating into the other tickers.",1631536348,hcolwt8,t3_pncese,/r/wallstreetbets/comments/pncese/daily_discussion_thread_for_september_13_2021/hcolwt8/,3,wallstreetbets
VisualMod,t2_6hf2z55l,I'm a bot from /r/wallstreetbets.                      You submitted a spam domain 'm.benzinga.com' and your submission was removed.,1631536353,hcolx3v,t3_pnefve,/r/wallstreetbets/comments/pnefve/gsat_fcc_filing_doesnt_relate_to_any_potential/hcolx3v/,1,wallstreetbets
Tersiv,t2_9171oy4x,in case you autists are interested in dipping toes into British stonks - I've bought the fuck out of the ASOS dip...,1631536356,hcolxap,t3_pmpbbs,/r/wallstreetbets/comments/pmpbbs/fraternal_association_of_gambling_gentlemen_and/hcolxap/,3,wallstreetbets
Thewolfofbearstreet,t2_c79k8bht,It’s fantastic that all us financial advisors can come together in this subreddit and exchange financial ideas,1631536358,hcolxgf,t3_pncese,/r/wallstreetbets/comments/pncese/daily_discussion_thread_for_september_13_2021/hcolxgf/,6,wallstreetbets
dudevinnie,t2_4f29mjw8,PSFE teams up with bunq for a ecash deal in 20ish European countries. Might be good for a small run this week but wouldn't say this is too exciting,1631536360,hcolxjl,t3_pncese,/r/wallstreetbets/comments/pncese/daily_discussion_thread_for_september_13_2021/hcolxjl/,4,wallstreetbets
[deleted],,[removed],1631536367,hcoly0h,t3_pndzcb,/r/wallstreetbets/comments/pndzcb/daily_popular_tickers_thread_for_september_13/hcoly0h/,1,wallstreetbets
Fictional-adult,t2_1p88t681,"You haven't suggested anything, you just gestured vaguely and said ""tax the rich."" 

How would you like to go about it? The ""ultra rich"" have the bulk of their salary paid in stock compensation.",1631536368,hcoly2k,t1_hcoj8hw,/r/wallstreetbets/comments/pmy7ej/sen_joe_manchin_says_theres_no_way_to_pass_35/hcoly2k/,0,wallstreetbets
[deleted],,[removed],1631536372,hcolyb2,t1_hcngu4m,/r/wallstreetbets/comments/pn2890/financial_freedom_achieved/hcolyb2/,1,wallstreetbets
tombstone1111,t2_7w4fsqvc,1 hour folks.. hope this bounce holds.,1631536373,hcolyd5,t3_pncese,/r/wallstreetbets/comments/pncese/daily_discussion_thread_for_september_13_2021/hcolyd5/,4,wallstreetbets
[deleted],,[removed],1631536374,hcolygk,t3_pncese,/r/wallstreetbets/comments/pncese/daily_discussion_thread_for_september_13_2021/hcolygk/,1,wallstreetbets
[deleted],,[removed],1631536375,hcolygw,t1_hcoldk7,/r/wallstreetbets/comments/pncese/daily_discussion_thread_for_september_13_2021/hcolygw/,1,wallstreetbets
boom_boom_man954,t2_c856bp1t,"DKNG sent me a spam text telling me to sign a petition for Florida.

They are desparate for this large market.

Currently FL wants online gambling to be run by the indians in florida",1631536377,hcolymk,t3_pncese,/r/wallstreetbets/comments/pncese/daily_discussion_thread_for_september_13_2021/hcolymk/,4,wallstreetbets
halfmanhalfrobot69,t2_2bywtd8,Well at least they will be alive to sue,1631536379,hcolysj,t1_hcole27,/r/wallstreetbets/comments/pncese/daily_discussion_thread_for_september_13_2021/hcolysj/,1,wallstreetbets
[deleted],,[removed],1631536385,hcolz61,t3_pncese,/r/wallstreetbets/comments/pncese/daily_discussion_thread_for_september_13_2021/hcolz61/,1,wallstreetbets
Matteomux,t2_4y7grx7c,Been long ZNGA for months this stonk is good 🎮🚀,1631536390,hcolzfm,t3_pn1lyz,/r/wallstreetbets/comments/pn1lyz/stocks_that_will_benefit_from_epicappstore_ruling/hcolzfm/,1,wallstreetbets
mousepop321,t2_2yvt18uq,Anyone want to pet my 🦆,1631536391,hcolzhp,t3_pncese,/r/wallstreetbets/comments/pncese/daily_discussion_thread_for_september_13_2021/hcolzhp/,-6,wallstreetbets
ebased,t2_7idhfw95,Lets do crazy shit yo! i feel reckless with my wife's money today,1631536391,hcolzj3,t3_pncese,/r/wallstreetbets/comments/pncese/daily_discussion_thread_for_september_13_2021/hcolzj3/,5,wallstreetbets
krisko11,t2_2o9ufcte,Oh shit is that a supra???!1!1!!,1631536396,hcolztr,t3_pmvf9c,/r/wallstreetbets/comments/pmvf9c/ape_in_the_wild/hcolztr/,1,wallstreetbets
pittluke,t2_ae4t9,Definitely worth staying for the money shot..  wait.. I didn't mean it like that..,1631536400,hcom04v,t1_hcojmb8,/r/wallstreetbets/comments/pndk9a/buy_the_dip_summon_jpow/hcom04v/,3,wallstreetbets
jrichjrich21,t2_a0updibv,"Straight up, CT drivers are responsible for 100% of my road rage",1631536403,hcom0bk,t1_hck22yr,/r/wallstreetbets/comments/pmrfo6/alright_which_one_of_you_clowns_is_this/hcom0bk/,1,wallstreetbets
Thewolfofbearstreet,t2_c79k8bht,Relax uranium goes brrrrrrrrrrrrrrr,1631536405,hcom0gc,t1_hcolve0,/r/wallstreetbets/comments/pncese/daily_discussion_thread_for_september_13_2021/hcom0gc/,7,wallstreetbets
sxrg,t2_59kpi,SPY pls open hulk green! that's all I'm asking,1631536406,hcom0id,t3_pncese,/r/wallstreetbets/comments/pncese/daily_discussion_thread_for_september_13_2021/hcom0id/,7,wallstreetbets
RichFelon,t2_d384pkvk,Everything is still so valued high even with the corrections.,1631536410,hcom0sx,t1_hcolwt8,/r/wallstreetbets/comments/pncese/daily_discussion_thread_for_september_13_2021/hcom0sx/,6,wallstreetbets
VisualMod,t2_6hf2z55l,"**Ticker Added ACAN**

Spam: True

Last Seen Market Cap: 19332850.0

Is SPAC: False

Common Word: False",1631536412,hcom0xq,t1_hcolpah,/r/wallstreetbets/comments/pncese/daily_discussion_thread_for_september_13_2021/hcom0xq/,0,wallstreetbets
