author,author_fullname,body,created_utc,id,parent_id,permalink,score,subreddit
bluedaddy1,t2_5wcn0u7q,This guy maths,1632227482,hdpkzxc,t1_hdpitlk,/r/wallstreetbets/comments/psg1cb/sell_me_this_chinese_contagion/hdpkzxc/,1,wallstreetbets
jbro12345,t2_n4cs6,How long before ASTS goes to 🌌?,1632227485,hdpl02s,t3_psfnmf,/r/wallstreetbets/comments/psfnmf/daily_discussion_thread_for_september_21_2021/hdpl02s/,1,wallstreetbets
NarutoVonnegut,t2_17xd1663,Why everything going up again? Is it a psyche out or did I get psyched out yesterday?,1632227489,hdpl0cr,t3_psfnmf,/r/wallstreetbets/comments/psfnmf/daily_discussion_thread_for_september_21_2021/hdpl0cr/,1,wallstreetbets
BarbellPadawan,t2_9j5tru72,That’s because Bill is super active on WSB.,1632227489,hdpl0dl,t1_hdpkkg8,/r/wallstreetbets/comments/psfnmf/daily_discussion_thread_for_september_21_2021/hdpl0dl/,1,wallstreetbets
AromaticFarmer,t2_3bk6cqry,McPlant coming to your block,1632227492,hdpl0jz,t3_psfnmf,/r/wallstreetbets/comments/psfnmf/daily_discussion_thread_for_september_21_2021/hdpl0jz/,1,wallstreetbets
TheBiggestDookie,t2_rws6w,Big fuk,1632227494,hdpl0nm,t1_hdpk5tx,/r/wallstreetbets/comments/psfnmf/daily_discussion_thread_for_september_21_2021/hdpl0nm/,1,wallstreetbets
TheRealBrokenbrains,t2_af4pr8cv,"I have some calls I got last week, but I’m buying some shares at open!",1632227495,hdpl0qf,t1_hdpgerk,/r/wallstreetbets/comments/psfnof/daily_popular_tickers_thread_for_september_21/hdpl0qf/,1,wallstreetbets
JpowYellen3some,t2_6ctazxya,"Can confirm, your mom told me the same thing this morning.",1632227498,hdpl0x9,t1_hdpku00,/r/wallstreetbets/comments/psfnmf/daily_discussion_thread_for_september_21_2021/hdpl0x9/,1,wallstreetbets
Key-Cucumber-1919,t2_7csirdke,It's a bull trap!,1632227499,hdpl10z,t1_hdpkitf,/r/wallstreetbets/comments/psfnmf/daily_discussion_thread_for_september_21_2021/hdpl10z/,1,wallstreetbets
fltpath,t2_9x953mx2,"Thank you for the time and effort!

I found the video on youtube as well. [https://www.youtube.com/watch?v=OF3talrmxiQ](https://www.youtube.com/watch?v=OF3talrmxiQ)

at 6:13, you get an idea of the size...at 6:36, there is the concept. In space, all of the smaller deploy then the pieces link up.

They also state they will need 200 of these phased arrays in orbit for coverage?

Its an interesting prototype, but at this point, a prototype that has not launched yet, nor been tested in space.

I see difficulty getting all of those little pieces to link up in space...there has to be hundreds. We see the issues the World had with Starlink, these are very, very small at only 5m span, compared to this array...

Next year they will launch the first array. If it is successful, there will be one.

Page 32: Looking at their costs, currently, there is not enough cash on hand to build the first one and launch it. (the exact amount from the SPAC and capital raised to date exactly matches the cost for the first launch???)

Lets say that is true, so currently, they have no cash left, right? It has all gone to factory build and the prototype. They claim not to begin revenue generation until 2023...which I am not sure that one array can generate 9 million customers and $181M in rev.

That is asking alot from subscribers to add another monthly fee to their bill with very, very limited coverage (for many , many years)

It appears there will have to be a significant offering in Q1/Q2 simply to keep going and keep building arrays.

To the business model of providing coverage where none exists...

There are reasons, in many under or un-developed countries why there is no coverage, they simply have no money. Keep in mind, the ASTS fee is in addition to the cell phone providers fee, and of course, there is a cost of the cell phone itself. These cell phone companies provide cell phones and service where there is a market to pay for such.

Yes, it is nice when someone visits remote areas to have cell phone coverage, but I am not really sure that this is worth paying the extra costs for (especially with the very limited coverage)

and really, until there is infrastructure in developing areas, I see no reason for a cell company to provide cell phones and service, simply for the ASTS add on.

My opinions:

Its an interesting concept, but given the shear size and number of the required array, I see a regulatory hurdle. The time required to set up 200 of these is another big issue for me.

I simply do not see the numbers of subscribers ramping up that fast, given that there is one array with limited coverage for a few minutes a day when it is overhead.

At a current $2.35Billion valuation...this company is at the pre-development, pre-testing, pre-approval and pre-revenue phase....there will be many more rounds of dilution, and the valuation leaves no upside for at least 10 years if even successful.

Sorry...",1632227501,hdpl154,t1_hdokavc,/r/wallstreetbets/comments/prx4qw/asts_how_douchebag_hedge_fund_bros_will_value_ast/hdpl154/,1,wallstreetbets
Cultural-Cattle5062,t2_a1jve1n2,"Probably an early adopter, your brother?",1632227502,hdpl160,t1_hdpeuxv,/r/wallstreetbets/comments/psde8t/i_wish_i_never_entered_into_this_shit_thanks/hdpl160/,1,wallstreetbets
Rich265,t2_2xyfe6xp,"$300B is just the smoke, the rest of the dumpster fire is being hidden. You think they are the only company? Half these companies are probably full on zombie companies.",1632227504,hdpl1bv,t1_hdpkvb6,/r/wallstreetbets/comments/psfnmf/daily_discussion_thread_for_september_21_2021/hdpl1bv/,1,wallstreetbets
OSRSkarma,t2_17bz2ly0,"Like i said, trade wars are easy to win",1632227505,hdpl1df,t1_hdpkz5r,/r/wallstreetbets/comments/psfnmf/daily_discussion_thread_for_september_21_2021/hdpl1df/,1,wallstreetbets
bromophobic272,t2_j7xx6,Exact same here bro. Bought at the bottom yesterday and hoping to make a quick buck on a bounce.,1632227506,hdpl1fl,t1_hdpkngc,/r/wallstreetbets/comments/psfnmf/daily_discussion_thread_for_september_21_2021/hdpl1fl/,1,wallstreetbets
RyChrome,t2_ktosh,It's a good day to YOLO my paycheck on $NVDA calls,1632227512,hdpl1sm,t3_psfnmf,/r/wallstreetbets/comments/psfnmf/daily_discussion_thread_for_september_21_2021/hdpl1sm/,1,wallstreetbets
[deleted],,[removed],1632227514,hdpl1xy,t3_psanbv,/r/wallstreetbets/comments/psanbv/september_fun/hdpl1xy/,1,wallstreetbets
RyChrome,t2_ktosh,I have depression.,1632227518,hdpl267,t3_psfnmf,/r/wallstreetbets/comments/psfnmf/daily_discussion_thread_for_september_21_2021/hdpl267/,1,wallstreetbets
RaisedByMonsters,t2_cq7yb,"Lol it already does. All of the ads I see on Reddit are either for gambling/lottery apps or for getting help for a gambling problem. It can’t decide, but it’s still trying to help me one way or another.",1632227522,hdpl2g9,t1_hdpkfqd,/r/wallstreetbets/comments/psfnmf/daily_discussion_thread_for_september_21_2021/hdpl2g9/,1,wallstreetbets
prolinez,t2_7gfjrfq6,🤢🤮,1632227526,hdpl2pg,t3_psh2rf,/r/wallstreetbets/comments/psh2rf/on_the_path_to_tendietown_with_mamawood/hdpl2pg/,1,wallstreetbets
Book_Of_Sand,t2_musb7,It'll get repressed back down soon enough. No worries,1632227528,hdpl2sf,t1_hdpkk5s,/r/wallstreetbets/comments/psfnmf/daily_discussion_thread_for_september_21_2021/hdpl2sf/,1,wallstreetbets
TheOriginalRK,t2_lzw4t,Some dude in China doesn’t pay his mortgage and the market starts to sell off. BS manipulation games by the MMs is all,1632227529,hdpl2uc,t3_psfnmf,/r/wallstreetbets/comments/psfnmf/daily_discussion_thread_for_september_21_2021/hdpl2uc/,2,wallstreetbets
Perryswoman,t2_ycf0l9z,Teeth?,1632227530,hdpl2x6,t1_hdpkg8f,/r/wallstreetbets/comments/psfnmf/daily_discussion_thread_for_september_21_2021/hdpl2x6/,1,wallstreetbets
BarbellPadawan,t2_9j5tru72,Any good theories on the vaccine?  What about anti masking?,1632227534,hdpl350,t1_hdpkgr0,/r/wallstreetbets/comments/psfnmf/daily_discussion_thread_for_september_21_2021/hdpl350/,1,wallstreetbets
[deleted],,[removed],1632227535,hdpl379,t1_hdoxepp,/r/wallstreetbets/comments/psanbv/september_fun/hdpl379/,1,wallstreetbets
OSRSkarma,t2_17bz2ly0,Ya no shit. But you act like china is gonna self destruct.. CCP will make it disappear as always,1632227535,hdpl381,t1_hdpl1bv,/r/wallstreetbets/comments/psfnmf/daily_discussion_thread_for_september_21_2021/hdpl381/,1,wallstreetbets
BenRobNU,t2_qah3e4v,"It's fucking boomery, but O is undervauled right now. Get that sweet sweet divvy money.",1632227537,hdpl3b0,t3_psfnmf,/r/wallstreetbets/comments/psfnmf/daily_discussion_thread_for_september_21_2021/hdpl3b0/,1,wallstreetbets
pewpew26,t2_13ve1e,Welcome to WSB,1632227541,hdpl3jf,t1_hdp27gi,/r/wallstreetbets/comments/ps1h9x/spy_60k_loss/hdpl3jf/,1,wallstreetbets
bromophobic272,t2_j7xx6,The SEC won’t let me be.,1632227545,hdpl3tc,t1_hdpkjwe,/r/wallstreetbets/comments/psfnmf/daily_discussion_thread_for_september_21_2021/hdpl3tc/,1,wallstreetbets
dundermifflin2019,t2_1vj7esrb,![img](emote|t5_2th52|4259),1632227545,hdpl3tu,t1_hdpkz8i,/r/wallstreetbets/comments/psfnmf/daily_discussion_thread_for_september_21_2021/hdpl3tu/,1,wallstreetbets
Spiritual_Extreme_81,t2_96ts4iwr,"Pigs get slaughtered 

Don’t come crying later",1632227548,hdpl404,t1_hdpkws1,/r/wallstreetbets/comments/psfnmf/daily_discussion_thread_for_september_21_2021/hdpl404/,1,wallstreetbets
Runner20mph,t2_1vy4ehbd,That picture tells a different story,1632227552,hdpl48y,t1_hdpka4o,/r/wallstreetbets/comments/psgeo9/whats_this_guy_looking_at/hdpl48y/,1,wallstreetbets
AutoModerator,t2_6l4z3,"News posts **must be market moving** and contain **new** information. Please avoid editorializing the title. 

If your post doesn't meet the requirements above, please delete the thread before a mod sees it.

*I am a bot, and this action was performed automatically. Please [contact the moderators of this subreddit](/message/compose/?to=/r/wallstreetbets) if you have any questions or concerns.*",1632227558,hdpl4ln,t3_pshs59,/r/wallstreetbets/comments/pshs59/check_out_my_new_song_with_my_own_beat/hdpl4ln/,1,wallstreetbets
VerySlump,t2_fkn5lwt,No,1632227561,hdpl4ts,t1_hdpkws1,/r/wallstreetbets/comments/psfnmf/daily_discussion_thread_for_september_21_2021/hdpl4ts/,1,wallstreetbets
Book_Of_Sand,t2_musb7,JPM will crush it soon; fear not,1632227563,hdpl4xm,t1_hdpkjeu,/r/wallstreetbets/comments/psfnmf/daily_discussion_thread_for_september_21_2021/hdpl4xm/,1,wallstreetbets
debugEntity,t2_9pkiu6gg,You’re right where you belong..,1632227564,hdpl4z0,t3_ps8h0u,/r/wallstreetbets/comments/ps8h0u/we_have_already_bottomed_out_today_was_not_the/hdpl4z0/,1,wallstreetbets
jhnnybgood,t2_9damb,"If there was a skeeter on Peter, would you whack him off?",1632227565,hdpl536,t1_hdpctxo,/r/wallstreetbets/comments/psgeo9/whats_this_guy_looking_at/hdpl536/,1,wallstreetbets
mousepop321,t2_2yvt18uq,End of day spy calls,1632227568,hdpl59g,t1_hdpl1sm,/r/wallstreetbets/comments/psfnmf/daily_discussion_thread_for_september_21_2021/hdpl59g/,1,wallstreetbets
[deleted],,[removed],1632227572,hdpl5fs,t1_hdpctxo,/r/wallstreetbets/comments/psgeo9/whats_this_guy_looking_at/hdpl5fs/,1,wallstreetbets
TheManagerDustBunny,t2_9upphmw5,Anyone got somewhere I can put my BigBags?,1632227572,hdpl5fx,t3_psfnmf,/r/wallstreetbets/comments/psfnmf/daily_discussion_thread_for_september_21_2021/hdpl5fx/,1,wallstreetbets
gambler_no_1,t2_1sopda47,"This comeback wont hold for 5 minutes, loading up on puts ✌",1632227572,hdpl5h0,t3_psfnmf,/r/wallstreetbets/comments/psfnmf/daily_discussion_thread_for_september_21_2021/hdpl5h0/,2,wallstreetbets
33nmakkie,t2_4n401unj,"If Evergrande was trading on Robinhood, we WallStreetBets  could have pushed it to the dark side of the 🌚 and all those shorters with it",1632227572,hdpl5h3,t3_pru4lm,/r/wallstreetbets/comments/pru4lm/chinense_real_estate_executives_rn/hdpl5h3/,1,wallstreetbets
swipeszizbak,t2_8fn0e6re,sir. IRNT. SPIR can be next,1632227573,hdpl5jb,t1_hdpkiu8,/r/wallstreetbets/comments/psfnof/daily_popular_tickers_thread_for_september_21/hdpl5jb/,1,wallstreetbets
Proof_Bookkeeper4556,t2_8qnoe3zu,"Upvote if bull

Downvote if bear

I want to gage sentiment",1632227575,hdpl5nj,t3_psfnmf,/r/wallstreetbets/comments/psfnmf/daily_discussion_thread_for_september_21_2021/hdpl5nj/,1,wallstreetbets
MaddiKertz,t2_7shjnwaa,Still too many boomers exist to legalize it,1632227575,hdpl5ob,t1_hdpkrmo,/r/wallstreetbets/comments/psfnmf/daily_discussion_thread_for_september_21_2021/hdpl5ob/,1,wallstreetbets
SquidGuyy,t2_cul76pzn,Is NOK a buy?,1632227576,hdpl5q1,t3_psfnmf,/r/wallstreetbets/comments/psfnmf/daily_discussion_thread_for_september_21_2021/hdpl5q1/,1,wallstreetbets
cramerscokenostril,t2_9hhd85tg,"Futures

Dow +.75% 

S&amp;P -1.00%

NASDIQ +.63%

S&amp;P can I offer you a motorized scooter?",1632227578,hdpl5ue,t3_psfnmf,/r/wallstreetbets/comments/psfnmf/daily_discussion_thread_for_september_21_2021/hdpl5ue/,1,wallstreetbets
Joy_McClure,t2_ld5wsfh,Ewt,1632227581,hdpl60o,t3_pshgax,/r/wallstreetbets/comments/pshgax/tesla_announces_expansion_of_its_biggest_virtual/hdpl60o/,1,wallstreetbets
Express-Image-7934,t2_73eqql2a,"Should I buy sdc? I wanna make money, not lose money",1632227581,hdpl616,t3_psfnof,/r/wallstreetbets/comments/psfnof/daily_popular_tickers_thread_for_september_21/hdpl616/,1,wallstreetbets
BOBI_2206,t2_90l1iwdn,Autist,1632227582,hdpl637,t3_psde8t,/r/wallstreetbets/comments/psde8t/i_wish_i_never_entered_into_this_shit_thanks/hdpl637/,1,wallstreetbets
DrizzyDrake_3,t2_jt6tr,Makes three of us. His mom's teets are 100.,1632227584,hdpl678,t1_hdphsg3,/r/wallstreetbets/comments/pse70u/this_is_an_opportunity_of_a_life_time_to_buy_call/hdpl678/,1,wallstreetbets
CoronaPooper,t2_2mfi3p81,Time to sell Nike puts,1632227588,hdpl6fd,t3_ps32o9,/r/wallstreetbets/comments/ps32o9/puts_on_consumer_companies_with_chinaa_exposure/hdpl6fd/,1,wallstreetbets
alp06h,t2_34yeydau,"I read this whole thing in Vlad's voice. 

Why have we closed your account? Great question congressman. As a young boy in Bulgaria ...",1632227590,hdpl6jr,t3_ps3s07,/r/wallstreetbets/comments/ps3s07/well_shit/hdpl6jr/,1,wallstreetbets
BodyMassAlone,t2_a44jdp2s,Hadn’t changed the price!!,1632227594,hdpl6sc,t3_psh7id,/r/wallstreetbets/comments/psh7id/smiledirectclub_furthers_europe_expansion_with/hdpl6sc/,1,wallstreetbets
anxiousnl,t2_57kojvs4,"All you need is love, da da dada dum",1632227600,hdpl75z,t3_psfnmf,/r/wallstreetbets/comments/psfnmf/daily_discussion_thread_for_september_21_2021/hdpl75z/,1,wallstreetbets
Yssrmw,t2_2n2rb5hd,"&gt;canceled!

colour me not impressed, grammar nazi",1632227600,hdpl766,t1_hdp6ez0,/r/wallstreetbets/comments/psf5wk/1929_is_canceled/hdpl766/,1,wallstreetbets
[deleted],,[removed],1632227601,hdpl78s,t1_hdpd73k,/r/wallstreetbets/comments/psgeo9/whats_this_guy_looking_at/hdpl78s/,1,wallstreetbets
Spiritual_Extreme_81,t2_96ts4iwr,This rug pull going to be epic 😁,1632227601,hdpl79f,t3_psfnmf,/r/wallstreetbets/comments/psfnmf/daily_discussion_thread_for_september_21_2021/hdpl79f/,1,wallstreetbets
AutoModerator,t2_6l4z3,"Reddit has a new paid team called **Anti-Evil Operations** which goes around permanently banning accounts for saying bad words. We made automod block them so you don't lose your account for saying a word and getting reported. It's not our rule, it's the entire website now, we're just trying to look out for our people. Sorry.

*I am a bot, and this action was performed automatically. Please [contact the moderators of this subreddit](/message/compose/?to=/r/wallstreetbets) if you have any questions or concerns.*",1632227601,hdpl7a0,t1_hdpl78s,/r/wallstreetbets/comments/psgeo9/whats_this_guy_looking_at/hdpl7a0/,1,wallstreetbets
JollySpaceCowboy,t2_a1s8t2pb,Top notch meme.,1632227604,hdpl7gr,t3_psggxh,/r/wallstreetbets/comments/psggxh/you_best_start_believing_in_market_crashes/hdpl7gr/,1,wallstreetbets
saltynuts1000,t2_6duw74tt,"It's either up, down or sideways today",1632227607,hdpl7nf,t3_psfnmf,/r/wallstreetbets/comments/psfnmf/daily_discussion_thread_for_september_21_2021/hdpl7nf/,1,wallstreetbets
JpowYellen3some,t2_6ctazxya,Some Chinese guy was thinking the same thing in 2008.,1632227620,hdpl8ho,t1_hdpl2uc,/r/wallstreetbets/comments/psfnmf/daily_discussion_thread_for_september_21_2021/hdpl8ho/,1,wallstreetbets
LanN00B,t2_103m5c,"Leap's and shares only, but yes.",1632227621,hdpl8jc,t1_hdpl5q1,/r/wallstreetbets/comments/psfnmf/daily_discussion_thread_for_september_21_2021/hdpl8jc/,1,wallstreetbets
Big-Toe6215,t2_94s89f65,Lehman only lost 500B.,1632227624,hdpl8pn,t1_hdpkvb6,/r/wallstreetbets/comments/psfnmf/daily_discussion_thread_for_september_21_2021/hdpl8pn/,1,wallstreetbets
niffrig,t2_5zhe7,It took more than 40 years to hit 700k aids fatalities.  At current rates covid will reach that in less than three years.  Cancers are a big one but I think it makes sense to stratify diseases by risk factors.  Because of that it's not apples to apples to compare covid to all cause cancers in my opinion.  The biggest cancer killer is lung at about 140k a year and second is colon/rectal at about 50k.  This two combined aren't matching year one covid.  Granted covid overall death rates should decline as we manage it better.  However we've yet to determine the longer term effects of covid..... Such as cancer like we see from things like HPV.  Anyway.  Tldr covid is arguably worse than AIDS or any particular cancer.  Luckily we have tools to combat it so maybe it doesn't have to be.  Go get vaccinated.,1632227626,hdpl8ty,t1_hdpel6l,/r/wallstreetbets/comments/psgeo9/whats_this_guy_looking_at/hdpl8ty/,1,wallstreetbets
Final_Bandicoot9017,t2_c76r2wyi,Wait. Who is going to panic sale after market open?,1632227638,hdpl9l4,t3_ps0mct,/r/wallstreetbets/comments/ps0mct/you_may_remember_me_as_the_guy_who_lost_286k_on/hdpl9l4/,1,wallstreetbets
EastBayRae,t2_6ikaf66,The Chinese somehow manage to fuck themselves and the rest of us at the same time. 200IQ moves.,1632227640,hdpl9ph,t1_hdpkgea,/r/wallstreetbets/comments/psfnmf/daily_discussion_thread_for_september_21_2021/hdpl9ph/,1,wallstreetbets
stuckinlimbo5,t2_c5aaimeg,id like to thank mlb the show community market for teaching me how to read trend graphs and do limit orders,1632227640,hdpl9qs,t3_psfnmf,/r/wallstreetbets/comments/psfnmf/daily_discussion_thread_for_september_21_2021/hdpl9qs/,1,wallstreetbets
hypekit,t2_1joo97ht,People have finished freaking out and have now forgot. Until the next news cycle. So lots has changed.,1632227640,hdpl9qu,t1_hdpkqmw,/r/wallstreetbets/comments/psfnmf/daily_discussion_thread_for_september_21_2021/hdpl9qu/,1,wallstreetbets
RyChrome,t2_ktosh,Perhaps. Don't really play $SPY though.,1632227643,hdpl9xt,t1_hdpl59g,/r/wallstreetbets/comments/psfnmf/daily_discussion_thread_for_september_21_2021/hdpl9xt/,1,wallstreetbets
[deleted],,[removed],1632227644,hdpl9yo,t1_hdpl5q1,/r/wallstreetbets/comments/psfnmf/daily_discussion_thread_for_september_21_2021/hdpl9yo/,1,wallstreetbets
soccerstar93,t2_7l38p,This very much feels like the days last year where Calls EOD  switch to Puts at open was a valid trading strategy,1632227645,hdpla1y,t3_psfnmf,/r/wallstreetbets/comments/psfnmf/daily_discussion_thread_for_september_21_2021/hdpla1y/,1,wallstreetbets
nerdicusboy,t2_e7z50t6q,"I'm still bitter over my Amazon earning trade. ""Good for you making a shit ton of money, but how dare you predict making a smidge less next quarter? -10%+ price lowered!!!!""",1632227648,hdpla9h,t1_hdpk7dd,/r/wallstreetbets/comments/psfnmf/daily_discussion_thread_for_september_21_2021/hdpla9h/,1,wallstreetbets
AdministrationOk5905,t2_8byw7c2j,Eh I guess I should just manually sell,1632227650,hdplaek,t1_hdpl404,/r/wallstreetbets/comments/psfnmf/daily_discussion_thread_for_september_21_2021/hdplaek/,1,wallstreetbets
SirHolyCow,t2_o6mvx,SPXU and VXX baby,1632227651,hdplafz,t1_hdpkpzm,/r/wallstreetbets/comments/psfnmf/daily_discussion_thread_for_september_21_2021/hdplafz/,1,wallstreetbets
jerseynate,t2_id5c5,🤣,1632227651,hdplahl,t1_hdpjs97,/r/wallstreetbets/comments/psfnmf/daily_discussion_thread_for_september_21_2021/hdplahl/,1,wallstreetbets
NoTransportation2899,t2_ao6o6n3g,feeling lame after literally choosing what fd’s to buy on spy for power hour yesterday and bitched out. It’s rare that such a rapid change in direction happens. Yuge $$ missed 🥺,1632227658,hdplawx,t3_psfnmf,/r/wallstreetbets/comments/psfnmf/daily_discussion_thread_for_september_21_2021/hdplawx/,1,wallstreetbets
koltd93,t2_10f6pi,A few months,1632227658,hdplaxt,t1_hdpl02s,/r/wallstreetbets/comments/psfnmf/daily_discussion_thread_for_september_21_2021/hdplaxt/,1,wallstreetbets
Big-Toe6215,t2_94s89f65,This time it's different.,1632227658,hdplay3,t3_psfnmf,/r/wallstreetbets/comments/psfnmf/daily_discussion_thread_for_september_21_2021/hdplay3/,1,wallstreetbets
MightyLul,t2_6lyijzjn,"Nooo, you think..?",1632227666,hdplbf2,t1_hdpl7nf,/r/wallstreetbets/comments/psfnmf/daily_discussion_thread_for_september_21_2021/hdplbf2/,1,wallstreetbets
hiohiohiza,t2_4h1w155a,My wife is leaving me for someone who is “evergrande” ![img](emote|t5_2th52|4276),1632227667,hdplbhr,t3_psfnmf,/r/wallstreetbets/comments/psfnmf/daily_discussion_thread_for_september_21_2021/hdplbhr/,1,wallstreetbets
Rich265,t2_2xyfe6xp,this ain't no Khashoggi. you can't just pack it up and dispose of the problem in a few suitcases.,1632227668,hdplbiz,t1_hdpl381,/r/wallstreetbets/comments/psfnmf/daily_discussion_thread_for_september_21_2021/hdplbiz/,1,wallstreetbets
JhoLow_1MDB,t2_8ru71dlb,Only WSB bulls buy calls right before the USA is about to default on its debt due to partisan bickering. lol...,1632227669,hdplbm8,t3_psfnmf,/r/wallstreetbets/comments/psfnmf/daily_discussion_thread_for_september_21_2021/hdplbm8/,2,wallstreetbets
DahyunDabFan,t2_c9eo6koq,Why can’t they pull a Joe Biden and make mortgages not matter?,1632227670,hdplbnv,t1_hdpl2uc,/r/wallstreetbets/comments/psfnmf/daily_discussion_thread_for_september_21_2021/hdplbnv/,1,wallstreetbets
StayAtHomeAstronaut,t2_foqhgs2,You should learn to spell,1632227673,hdplbvr,t1_hdpl5nj,/r/wallstreetbets/comments/psfnmf/daily_discussion_thread_for_september_21_2021/hdplbvr/,2,wallstreetbets
FoSchnitzel,t2_3feyk3v9,"Not a problem, actually. We've just passed this increase on to the consumers.

Think of this cost as just another component of the hidden Biden Tax we used to call ""inflation"". It's all good. The mainstream media will curate the issue away from the headlines, or Facebook. There's nothing to see here.",1632227674,hdplbz9,t1_hdp02at,/r/wallstreetbets/comments/pse0cq/cost_to_ship_ocean_frieght_containers_from/hdplbz9/,1,wallstreetbets
saltynuts1000,t2_6duw74tt,Shampoo and conditioner,1632227676,hdplc17,t1_hdpkeah,/r/wallstreetbets/comments/psfnmf/daily_discussion_thread_for_september_21_2021/hdplc17/,1,wallstreetbets
rearviewviewer,t2_xx1wz,The world is more and more like idiocracy everyday,1632227676,hdplc2u,t3_ps88oi,/r/wallstreetbets/comments/ps88oi/live_footage_of_robinhood_customer_service/hdplc2u/,1,wallstreetbets
coxidasical,t2_hets7,Robinhooders will make futures moon at 9 right? /s,1632227678,hdplc6c,t3_psfnmf,/r/wallstreetbets/comments/psfnmf/daily_discussion_thread_for_september_21_2021/hdplc6c/,1,wallstreetbets
4tacos_al_pastor,t2_dqm85nkp,What are you talking about gold is up $9,1632227680,hdplcb1,t1_hdpkk5s,/r/wallstreetbets/comments/psfnmf/daily_discussion_thread_for_september_21_2021/hdplcb1/,1,wallstreetbets
[deleted],,[removed],1632227682,hdplcg3,t3_psanbv,/r/wallstreetbets/comments/psanbv/september_fun/hdplcg3/,1,wallstreetbets
Commodore64__,t2_7hmxeo1t,🌈🌈🌈🌈🌈🌈🐻🐻🐻🐻🐻🐻🐻 Meme!,1632227683,hdplcii,t3_psggxh,/r/wallstreetbets/comments/psggxh/you_best_start_believing_in_market_crashes/hdplcii/,1,wallstreetbets
[deleted],,[removed],1632227684,hdplcjs,t3_pshlgt,/r/wallstreetbets/comments/pshlgt/im_trader_red_day/hdplcjs/,1,wallstreetbets
Runner20mph,t2_1vy4ehbd, BFTD,1632227684,hdplclh,t3_psgeo9,/r/wallstreetbets/comments/psgeo9/whats_this_guy_looking_at/hdplclh/,1,wallstreetbets
TheBiggestDookie,t2_rws6w,God’s loophole.,1632227687,hdplcsu,t1_hdpjym7,/r/wallstreetbets/comments/psfnmf/daily_discussion_thread_for_september_21_2021/hdplcsu/,1,wallstreetbets
slawre89,t2_5zyba,Are you gonna be showing us your O face? O…O…you know what I’m talking about,1632227691,hdpld1h,t1_hdpl3b0,/r/wallstreetbets/comments/psfnmf/daily_discussion_thread_for_september_21_2021/hdpld1h/,1,wallstreetbets
dundermifflin2019,t2_1vj7esrb,Stonks only go up.  That is all.  📈,1632227700,hdpldo9,t3_psfnmf,/r/wallstreetbets/comments/psfnmf/daily_discussion_thread_for_september_21_2021/hdpldo9/,1,wallstreetbets
OSRSkarma,t2_17bz2ly0,"Okay, go tell that too president Pooh 🐻",1632227700,hdpldox,t1_hdplbiz,/r/wallstreetbets/comments/psfnmf/daily_discussion_thread_for_september_21_2021/hdpldox/,1,wallstreetbets
TeddyToothpick,t2_iqe9p,"He doesn't have to be. He just needs to do his job and represent his constituents, which from experience, i think he does.",1632227703,hdpldut,t1_hdphkug,/r/wallstreetbets/comments/psanbv/september_fun/hdpldut/,1,wallstreetbets
UnderB0SS,t2_oqmbb,"Because I wasn’t cool enough to have bought puts on Friday, I’m taking this little dead cat bounce moment to add puts to my index holdings, not entirely for protection, but more for a revenue opportunity while I ride out the storm before I start putting my 30% cash to work. It’s September my friends. Act accordingly. 

#BoomersOfWSB",1632227704,hdpldwl,t3_psfnmf,/r/wallstreetbets/comments/psfnmf/daily_discussion_thread_for_september_21_2021/hdpldwl/,1,wallstreetbets
yellow99y,t2_6wm5hi6s,"it was a good one too, because it plays on fears left over from the GFC",1632227707,hdple40,t1_hdpl2uc,/r/wallstreetbets/comments/psfnmf/daily_discussion_thread_for_september_21_2021/hdple40/,1,wallstreetbets
