author,author_fullname,body,created_utc,id,parent_id,permalink,score,subreddit
Radiant_Analyst_9281,t2_cr22bke6,Be quiet before that retard cathie wood comes in here and literally buys China,1631968963,hdbq98j,t3_pqg7o7,/r/wallstreetbets/comments/pqg7o7/michael_burry_confirms_china_collapse_incoming_12t/hdbq98j/,1,wallstreetbets
Ignatiuss_JReilly,t2_a3nkh0y1,He went Col-in and lost it all poor sod ![img](emote|t5_2th52|4271),1631881892,hd777pc,t3_ppy1ca,/r/wallstreetbets/comments/ppy1ca/world_wealth_loss_champion_make_this_guy_a_mod/hd777pc/,1,wallstreetbets
AutoModerator,t2_6l4z3,"Oh my gourd! 


*I am a bot, and this action was performed automatically. Please [contact the moderators of this subreddit](/message/compose/?to=/r/wallstreetbets) if you have any questions or concerns.*",1631881892,hd777qc,t1_hd777pc,/r/wallstreetbets/comments/ppy1ca/world_wealth_loss_champion_make_this_guy_a_mod/hd777qc/,2,wallstreetbets
NoTransportation2899,t2_ao6o6n3g,Sell calls above the strike you bought to preserve gains when no daytrades,1631881896,hd777yy,t1_hd774z6,/r/wallstreetbets/comments/ppx8ia/daily_discussion_thread_for_september_17_2021/hd777yy/,8,wallstreetbets
[deleted],,[removed],1631881896,hd77801,t3_ppx8ia,/r/wallstreetbets/comments/ppx8ia/daily_discussion_thread_for_september_17_2021/hd77801/,1,wallstreetbets
antipiracylaws,t2_3s7vl4a,"I don't know how to communicate anymore, DeVos defunded my ethics and grammar classes",1631881897,hd7781t,t1_hd75ul6,/r/wallstreetbets/comments/ppy1ca/world_wealth_loss_champion_make_this_guy_a_mod/hd7781t/,25,wallstreetbets
stevehockey4,t2_3513q8xl,I actually just bought some at Giant Eagle for $0.85. Woohoo!,1631881899,hd7787h,t3_pptmzd,/r/wallstreetbets/comments/pptmzd/inflation_disproven_dd_inside/hd7787h/,1,wallstreetbets
[deleted],,[removed],1631881900,hd7789p,t3_ppx8ia,/r/wallstreetbets/comments/ppx8ia/daily_discussion_thread_for_september_17_2021/hd7789p/,1,wallstreetbets
unarmedarmenian,t2_zotix,"Boy, he really Huang on to some if those stocks too long, didn’t he?",1631881903,hd778f4,t3_ppy1ca,/r/wallstreetbets/comments/ppy1ca/world_wealth_loss_champion_make_this_guy_a_mod/hd778f4/,2,wallstreetbets
diggin-the-doge,t2_a1f5xktg,![img](emote|t5_2th52|4271),1631881905,hd778k8,t1_hd773m8,/r/wallstreetbets/comments/ppx8ia/daily_discussion_thread_for_september_17_2021/hd778k8/,5,wallstreetbets
RH_Fucked_My_Account,t2_6pyq88ab,Need Apple to close over 150 EOD 📈🍏,1631881906,hd778lp,t3_ppx8ia,/r/wallstreetbets/comments/ppx8ia/daily_discussion_thread_for_september_17_2021/hd778lp/,7,wallstreetbets
Forestur,t2_2uf7y0jl,they weren’t 0DTE when i bought em 😭😭,1631881906,hd778mq,t1_hd7664u,/r/wallstreetbets/comments/ppx8ia/daily_discussion_thread_for_september_17_2021/hd778mq/,1,wallstreetbets
IllIlIlllIlllllI,t2_ar9pe51z,Ain’t no way MMs let these Apple 150 lottos hit,1631881907,hd778o0,t3_ppx8ia,/r/wallstreetbets/comments/ppx8ia/daily_discussion_thread_for_september_17_2021/hd778o0/,3,wallstreetbets
I_Have_3_Legs,t2_ohurw,Bitching about a dude simply clarifying on a topic we were discussing.,1631881907,hd778ps,t1_hd76wre,/r/wallstreetbets/comments/pptmzd/inflation_disproven_dd_inside/hd778ps/,3,wallstreetbets
wallstreetarcher,t2_6o7mqbqy,Entire account in FDs expiring today. Hedged &amp; Leveraged to the tits.  Open the casino!,1631881913,hd7792j,t3_ppx8ia,/r/wallstreetbets/comments/ppx8ia/daily_discussion_thread_for_september_17_2021/hd7792j/,5,wallstreetbets
pampls,t2_uow97ct,It's all guh'd!,1631881914,hd7796b,t1_hd60nyl,/r/wallstreetbets/comments/ppmyal/now_you_know/hd7796b/,1,wallstreetbets
[deleted],,[removed],1631881916,hd7799l,t3_pptmzd,/r/wallstreetbets/comments/pptmzd/inflation_disproven_dd_inside/hd7799l/,1,wallstreetbets
[deleted],,[removed],1631881917,hd779b3,t3_ppy0gh,/r/wallstreetbets/comments/ppy0gh/introducing_friends_to_wsb/hd779b3/,1,wallstreetbets
Rokustickmaketendies,t2_53fedday,Smiling Directly at your Chubby wife ❤️,1631881920,hd779jb,t1_hd75sxv,/r/wallstreetbets/comments/ppx8ia/daily_discussion_thread_for_september_17_2021/hd779jb/,-1,wallstreetbets
StonkDoctor1000,t2_9z0opsh3,"DOMA GONA MAKE ME COMA 

DOMA 🚀",1631881922,hd779o3,t3_ppx8ia,/r/wallstreetbets/comments/ppx8ia/daily_discussion_thread_for_september_17_2021/hd779o3/,2,wallstreetbets
deniler,t2_9y03klwz,Diane Fossey was a pioneer in trans-species virus transmissions,1631881925,hd779tc,t1_hd75kh0,/r/wallstreetbets/comments/ppx8ia/daily_discussion_thread_for_september_17_2021/hd779tc/,1,wallstreetbets
mynameisnotgrey,t2_2pt5yfg,What a weird way to write 2.5 million,1631881927,hd779zj,t1_hd74zms,/r/wallstreetbets/comments/ppy1ca/world_wealth_loss_champion_make_this_guy_a_mod/hd779zj/,4,wallstreetbets
VisualMod,t2_6hf2z55l,I am a bot from /r/wallstreetbets. Your submission was removed because it was either DD or Discussion and not a text post.,1631881927,hd77a09,t3_ppz9ek,/r/wallstreetbets/comments/ppz9ek/cvrs_52_premarket_i_cant_find_the_reason_why/hd77a09/,1,wallstreetbets
[deleted],,[removed],1631881929,hd77a35,t3_ppx8ia,/r/wallstreetbets/comments/ppx8ia/daily_discussion_thread_for_september_17_2021/hd77a35/,1,wallstreetbets
magnum_dong_opus,t2_bz95y5us,"#SDC

#YOU SUCK DICK WITH YOUR MOUTH, NOT YOUR BODY",1631881933,hd77acs,t1_hd773fh,/r/wallstreetbets/comments/ppx8ia/daily_discussion_thread_for_september_17_2021/hd77acs/,8,wallstreetbets
Bexanderthebex,t2_151a6e,Do wendy’s give dividends?,1631881933,hd77ad7,t3_ppx8ia,/r/wallstreetbets/comments/ppx8ia/daily_discussion_thread_for_september_17_2021/hd77ad7/,6,wallstreetbets
iThinkiStartedATrend,t2_aeqzb,I don’t know where I saw it either.  My brain is so smooth,1631881933,hd77adf,t1_hd76k98,/r/wallstreetbets/comments/ppx8ia/daily_discussion_thread_for_september_17_2021/hd77adf/,1,wallstreetbets
da_muffinman,t2_4yuhg,I don't think I've seen anyone wear crocs outside of a like lake environment ever. I don't dislike them but it's like who is buying these lol,1631881933,hd77adu,t1_hd770v8,/r/wallstreetbets/comments/ppx8ia/daily_discussion_thread_for_september_17_2021/hd77adu/,1,wallstreetbets
Funny_Story2759,t2_4kgmp04g,does the cucumber taste better pickled?,1631881933,hd77ae7,t1_hd76s8w,/r/wallstreetbets/comments/ppx8r0/daily_popular_tickers_thread_for_september_17/hd77ae7/,8,wallstreetbets
K-Kraft,t2_bl1cf20w,"They should make a law where all the people who decided to not go to college pay for your college so you can be their boss later and be the one to not give them raises, seems fair!",1631881937,hd77anc,t1_hd72yny,/r/wallstreetbets/comments/ppy1ca/world_wealth_loss_champion_make_this_guy_a_mod/hd77anc/,13,wallstreetbets
KingMisFit007,t2_6x76zqsl,"I like it
Wondering how the new mini iPad will be.",1631881939,hd77aqy,t1_hd76sdp,/r/wallstreetbets/comments/ppx8ia/daily_discussion_thread_for_september_17_2021/hd77aqy/,1,wallstreetbets
wasabiEatingMoonMan,t2_55okfyrj,LFG. 🚀🚀🚀 I’m so anxious for this make our break open lol,1631881939,hd77as6,t1_hd6u3pd,/r/wallstreetbets/comments/ppb0k0/daily_popular_tickers_thread_for_september_16/hd77as6/,1,wallstreetbets
bonquisha_,t2_gjbj0,"possible, delta hedging goes both ways depending on the momentum",1631881942,hd77azi,t1_hd76zxa,/r/wallstreetbets/comments/ppx8r0/daily_popular_tickers_thread_for_september_17/hd77azi/,1,wallstreetbets
Fragrant-War-344,t2_9xewy948,Lenders are loving their new style of risk assessment over FICO,1631881946,hd77b8b,t1_hd76zr4,/r/wallstreetbets/comments/ppx8ia/daily_discussion_thread_for_september_17_2021/hd77b8b/,1,wallstreetbets
Dumbmechanic69,t2_age3ho5o,They didn't start as 0dte for me,1631881947,hd77bbc,t1_hd756sa,/r/wallstreetbets/comments/ppx8ia/daily_discussion_thread_for_september_17_2021/hd77bbc/,4,wallstreetbets
GreenLlamaSpit,t2_4divd7cw,What a fucking legend!,1631881948,hd77bcl,t3_ppmyal,/r/wallstreetbets/comments/ppmyal/now_you_know/hd77bcl/,1,wallstreetbets
somerandomguy101010,t2_4pryfu5u,"My dentist had to do a lot for my Invisalign, I had to have gaps cut in my teeth for them to move together. How are they doing that through the mail?",1631881952,hd77bnb,t1_hd76fzh,/r/wallstreetbets/comments/ppx8ia/daily_discussion_thread_for_september_17_2021/hd77bnb/,2,wallstreetbets
Unemployable1593,t2_9be9emj1,"floor press, deadlift, power clean, front squat, bent over row

plenty of legs, push and pull for upper body, one piece of equipment",1631881953,hd77bqc,t1_hd76sw6,/r/wallstreetbets/comments/ppx8ia/daily_discussion_thread_for_september_17_2021/hd77bqc/,2,wallstreetbets
Appropriate_Spend659,t2_971y6sb5,"Homeless shelter is always an option. No over head, more tendies for dumb decisions.",1631881957,hd77bzf,t1_hd7692a,/r/wallstreetbets/comments/ppx8r0/daily_popular_tickers_thread_for_september_17/hd77bzf/,10,wallstreetbets
ConsciousAgent1,t2_65w6wydk,Nope I'm gay. For dinosaurs,1631881959,hd77c47,t1_hd779jb,/r/wallstreetbets/comments/ppx8ia/daily_discussion_thread_for_september_17_2021/hd77c47/,1,wallstreetbets
Bexanderthebex,t2_151a6e,Ahh yes we dump at open again?,1631881959,hd77c49,t3_ppx8ia,/r/wallstreetbets/comments/ppx8ia/daily_discussion_thread_for_september_17_2021/hd77c49/,2,wallstreetbets
tjtothek,t2_bskp8,"Don't be silly with his money he can just buy the mega yacht making company, he just can't afford to take over the whole industry, what a loser",1631881961,hd77c9d,t1_hd72w7q,/r/wallstreetbets/comments/ppy1ca/world_wealth_loss_champion_make_this_guy_a_mod/hd77c9d/,10,wallstreetbets
Naliox,t2_fhamq,SDC got me feeling like christmas morning,1631881963,hd77ccm,t3_ppx8ia,/r/wallstreetbets/comments/ppx8ia/daily_discussion_thread_for_september_17_2021/hd77ccm/,18,wallstreetbets
[deleted],,[removed],1631881963,hd77cdy,t3_ppx8ia,/r/wallstreetbets/comments/ppx8ia/daily_discussion_thread_for_september_17_2021/hd77cdy/,1,wallstreetbets
get_MEAN_yall,t2_njjby,"They're great boat shoes. Comfy, waterproof and grippy against gelcoat.",1631881966,hd77cjm,t1_hd77adu,/r/wallstreetbets/comments/ppx8ia/daily_discussion_thread_for_september_17_2021/hd77cjm/,2,wallstreetbets
ForestFyre,t2_rh5g0,I said to myself about 6 months ago before earnings there is no way it can go up anymore. It’s up over 80% since then. I cry every time I see the 1yr.,1631881968,hd77cph,t1_hd770v8,/r/wallstreetbets/comments/ppx8ia/daily_discussion_thread_for_september_17_2021/hd77cph/,2,wallstreetbets
Pittaandchicken,t2_mx2okl1,Maybe the comment chain would be dead if people like you stopped elongating it?,1631881970,hd77csk,t1_hd778ps,/r/wallstreetbets/comments/pptmzd/inflation_disproven_dd_inside/hd77csk/,0,wallstreetbets
Rokustickmaketendies,t2_53fedday,So you’re saying more the MMs have to sell when calls close our? Sounds bearish to me,1631881977,hd77d9y,t1_hd75rko,/r/wallstreetbets/comments/ppx8ia/daily_discussion_thread_for_september_17_2021/hd77d9y/,1,wallstreetbets
blu6-,t2_ozdp5p,"LETS GO SMAL DICK CLUB , CMON THIS THE ULTIMATE MEME SDC!!!!",1631881985,hd77dsy,t3_ppx8ia,/r/wallstreetbets/comments/ppx8ia/daily_discussion_thread_for_september_17_2021/hd77dsy/,14,wallstreetbets
nuknoe,t2_isedw,I never heard of SDC to this degree until like a month ago. I sell insurance and have a few plans. I'll be using my gains to pay for oop expenses.,1631881986,hd77dvj,t1_hd6gp4p,/r/wallstreetbets/comments/ppkudo/what_are_your_moves_tomorrow_september_17_2021/hd77dvj/,1,wallstreetbets
fallweathercamping,t2_3xw9glyh,"If it’s Huang, I don’t wanna be Hwight!",1631881989,hd77e30,t3_ppy1ca,/r/wallstreetbets/comments/ppy1ca/world_wealth_loss_champion_make_this_guy_a_mod/hd77e30/,5,wallstreetbets
[deleted],,[removed],1631881990,hd77e5h,t3_ppyykx,/r/wallstreetbets/comments/ppyykx/profit_baby/hd77e5h/,1,wallstreetbets
000Kurpitsa000,t2_1z85h5uc,Who spends money to host a bot like this ![img](emote|t5_2th52|4271),1631881993,hd77ec7,t1_hd773m8,/r/wallstreetbets/comments/ppx8ia/daily_discussion_thread_for_september_17_2021/hd77ec7/,6,wallstreetbets
lacsaddict,t2_5yhqkmww,"I just realized you said gains and losses from different years, rip.
Not financial advise, but you might become a certified trader based on your success from last year and be able to carry those losses. No income tax due the next 5yrs if so.",1631882001,hd77evw,t1_hd76lnc,/r/wallstreetbets/comments/ppq188/made_over_300k_last_yearpayed_irs_and_then_lost/hd77evw/,1,wallstreetbets
koltd93,t2_10f6pi,Lots of DD on it all week. Search and read up,1631882002,hd77ey8,t1_hd7521a,/r/wallstreetbets/comments/ppx8r0/daily_popular_tickers_thread_for_september_17/hd77ey8/,0,wallstreetbets
showandblowyourload,t2_ijuhelv,ern't,1631882009,hd77fcl,t1_hd771t8,/r/wallstreetbets/comments/ppx8r0/daily_popular_tickers_thread_for_september_17/hd77fcl/,4,wallstreetbets
Rokustickmaketendies,t2_53fedday,Calls are cheap and any retard can buy them. Even the Wendy’s janitor,1631882009,hd77fcw,t1_hd75qlj,/r/wallstreetbets/comments/ppx8ia/daily_discussion_thread_for_september_17_2021/hd77fcw/,1,wallstreetbets
Mrjjiiggyy,t2_4e8yrcno,Fellow dutchy; my eyes are hurting. Loving the diversification.,1631882015,hd77fqf,t1_hd756ko,/r/wallstreetbets/comments/ppx8r0/daily_popular_tickers_thread_for_september_17/hd77fqf/,4,wallstreetbets
[deleted],,[deleted],1631882017,hd77fwv,t1_hd76no4,/r/wallstreetbets/comments/ppx8ia/daily_discussion_thread_for_september_17_2021/hd77fwv/,0,wallstreetbets
mashiro1496,t2_2dzwmv80,Will GME go up today?,1631882023,hd77gay,t3_ppx8ia,/r/wallstreetbets/comments/ppx8ia/daily_discussion_thread_for_september_17_2021/hd77gay/,3,wallstreetbets
NannyVarmint,t2_ys8a2,Why didn’t he just hodl?.. fucking pleb,1631882024,hd77gf4,t3_ppy1ca,/r/wallstreetbets/comments/ppy1ca/world_wealth_loss_champion_make_this_guy_a_mod/hd77gf4/,9,wallstreetbets
Hernand27,t2_a0zwfb51,Both split it,1631882028,hd77goy,t1_hd773fh,/r/wallstreetbets/comments/ppx8ia/daily_discussion_thread_for_september_17_2021/hd77goy/,3,wallstreetbets
Dieseldaddy74,t2_a3d4fhhe,"Did Toyota girls ass get bigger, or just hip spread from poppin out tax credits?",1631882029,hd77gq4,t3_ppx8ia,/r/wallstreetbets/comments/ppx8ia/daily_discussion_thread_for_september_17_2021/hd77gq4/,3,wallstreetbets
unarmedarmenian,t2_zotix,"I mean in a way, he likely did. I’m sure some people here sold their shares to him at a high and he was stuck holding the bag.",1631882030,hd77gsy,t1_hd74zms,/r/wallstreetbets/comments/ppy1ca/world_wealth_loss_champion_make_this_guy_a_mod/hd77gsy/,8,wallstreetbets
cashflow_,t2_527ci52f,Futes were down 0.3% 😡,1631882031,hd77gtx,t3_ppx8ia,/r/wallstreetbets/comments/ppx8ia/daily_discussion_thread_for_september_17_2021/hd77gtx/,1,wallstreetbets
Momma_Sophie,t2_nv1w7,"445.55

Again.",1631882031,hd77gvb,t3_ppx8ia,/r/wallstreetbets/comments/ppx8ia/daily_discussion_thread_for_september_17_2021/hd77gvb/,2,wallstreetbets
[deleted],,[removed],1631882033,hd77gzz,t1_hd773m8,/r/wallstreetbets/comments/ppx8ia/daily_discussion_thread_for_september_17_2021/hd77gzz/,1,wallstreetbets
Wonderboi1995,t2_62r2t4tu,Insiders selling the heck out of it too...http://openinsider.com/search?q=BLI,1631882034,hd77h3t,t3_ppz39r,/r/wallstreetbets/comments/ppz39r/this_is_going_straight_to_0_great_research_by/hd77h3t/,3,wallstreetbets
lukebreit,t2_86b53a42,So asking women to cover their breasts at the beach is sexist right?,1631882034,hd77h3z,t3_ppx8ia,/r/wallstreetbets/comments/ppx8ia/daily_discussion_thread_for_september_17_2021/hd77h3z/,4,wallstreetbets
elSchiz,t2_nfbxk,"Has me wondering what I should do with my calls. It's so volatile and expire today (like everyone else's), do I risk the day play or take profit/what I can at open?",1631882035,hd77h4h,t1_hd75bpu,/r/wallstreetbets/comments/ppx8r0/daily_popular_tickers_thread_for_september_17/hd77h4h/,3,wallstreetbets
Codyskank,t2_yo3bj,And down,1631882037,hd77ha7,t1_hd77gay,/r/wallstreetbets/comments/ppx8ia/daily_discussion_thread_for_september_17_2021/hd77ha7/,1,wallstreetbets
Ricky_Bobby3986,t2_4uxw57y1,The markets know tapering is coming. If you don’t think they are slowly pricing that shit in you’re nuts.,1631882037,hd77hcj,t1_hd75af5,/r/wallstreetbets/comments/ppx8ia/daily_discussion_thread_for_september_17_2021/hd77hcj/,1,wallstreetbets
[deleted],,[removed],1631882039,hd77hfn,t3_ppx8ia,/r/wallstreetbets/comments/ppx8ia/daily_discussion_thread_for_september_17_2021/hd77hfn/,1,wallstreetbets
starbucknstonks,t2_brewmdpd,"you send them a clay sample and they make a plan for you

you stuck in 1997 bro",1631882041,hd77hli,t1_hd77bnb,/r/wallstreetbets/comments/ppx8ia/daily_discussion_thread_for_september_17_2021/hd77hli/,1,wallstreetbets
[deleted],,[removed],1631882043,hd77hrr,t3_ppx8ia,/r/wallstreetbets/comments/ppx8ia/daily_discussion_thread_for_september_17_2021/hd77hrr/,11,wallstreetbets
ftrees,t2_akmzj,"It goes to $100 and you lose $35,000?",1631882044,hd77htf,t1_hd67man,/r/wallstreetbets/comments/ppn8w3/how_fucked_am_i_irnt/hd77htf/,1,wallstreetbets
cyberslick188,t2_5oflh,Who gives a fuck what the company does on short play bets.,1631882044,hd77htj,t3_ppx1sl,/r/wallstreetbets/comments/ppx1sl/when_you_throw_all_your_savings_in_another_gamma/hd77htj/,45,wallstreetbets
bahetrick1,t2_5dyaccjl,F in the chat if you think PM is fake and gay,1631882044,hd77hu6,t3_ppx8ia,/r/wallstreetbets/comments/ppx8ia/daily_discussion_thread_for_september_17_2021/hd77hu6/,1,wallstreetbets
Leight87,t2_16vqqs,"I can see that. I tend to stick to high volume tickers, so I’ve never had a problem. But, yes, an option play with low OI could present a problem with selling off.",1631882047,hd77hzv,t1_hd74j7n,/r/wallstreetbets/comments/ppo5hq/chill_the_fuck_out_and_read_this_irnt_opad/hd77hzv/,2,wallstreetbets
indigoismyfavorite,t2_e6idcyye,"because you might be away from home, meeting a group of people, or meeting someone new, etc",1631882047,hd77i10,t1_hd772k4,/r/wallstreetbets/comments/ppx8ia/daily_discussion_thread_for_september_17_2021/hd77i10/,1,wallstreetbets
Walpurgisborn,t2_2mmwjvqe,It's really the only meme stock that might actually go to the moon.,1631882048,hd77i1z,t3_ppj6pt,/r/wallstreetbets/comments/ppj6pt/asts_porn_play_with_gamma_squeeze_potentialshort/hd77i1z/,12,wallstreetbets
beardstachioso,t2_3wz6qbks,"There is only one Diversification, and it's called YOLO'ING",1631882050,hd77i6z,t1_hd77fqf,/r/wallstreetbets/comments/ppx8r0/daily_popular_tickers_thread_for_september_17/hd77i6z/,3,wallstreetbets
[deleted],,[deleted],1631882050,hd77i8o,t1_hd779zj,/r/wallstreetbets/comments/ppy1ca/world_wealth_loss_champion_make_this_guy_a_mod/hd77i8o/,0,wallstreetbets
Juicy_Brucesky,t2_ix24t,"The company he owns got cracked down on and the stock tumbled. It's not like he was reading the ""market crash incoming"" posts on WSB and bought billions in SPY puts.









It would be like calling Bezo's retarded because a government crackdown crashed his stock and he lost billions. But if he sold that stock you guys would be saying he lost faith in the company. I dunno, I still think this sub has plenty more retards than this guy. Holding stock in the company you own while it crashes is just what happens when you own a company, that's why people like the owners owning lots of the stock in their company because it shows they have faith in it's future. I know I've seen this sub constantly get front page posts on a CEO every time he dumps .05% of his holdings in the company. ""He's lost faith, it's going to to tank!!!1!""











Unless I'm misunderstanding here, but by the sound of it this guy didn't lose his fortune buying CLOV calls and SPY puts",1631882056,hd77im1,t1_hd74o3s,/r/wallstreetbets/comments/ppy1ca/world_wealth_loss_champion_make_this_guy_a_mod/hd77im1/,115,wallstreetbets
[deleted],,[removed],1631882058,hd77ipy,t3_msblc3,/r/wallstreetbets/comments/msblc3/gme_yolo_update_apr_16_2021_final_update/hd77ipy/,1,wallstreetbets
SeniorArmy,t2_7s7801wc,I talked with my dentist friend and he legit said it’s the future of the orthodontics industry. He’ll recommend it to patients because it’s cheap and it works,1631882062,hd77j0g,t1_hd76t1p,/r/wallstreetbets/comments/ppx8ia/daily_discussion_thread_for_september_17_2021/hd77j0g/,2,wallstreetbets
Codyskank,t2_yo3bj,It’s also stupid,1631882065,hd77j94,t1_hd77h3z,/r/wallstreetbets/comments/ppx8ia/daily_discussion_thread_for_september_17_2021/hd77j94/,6,wallstreetbets
Whats_Up_Joe,t2_5sco18mk,"IRNT 9/17 options

Under 30 strikes remain over 100% of the float

30-36 is another 100%

37-39 is under 100% but of course that brings us near 300% if it rallies, and that doesn't include shorts. It's much more after 40.

Today could get interesting. Also I'm an idiot and this is just thismorning yahoo finance data",1631882068,hd77jdb,t3_ppx8r0,/r/wallstreetbets/comments/ppx8r0/daily_popular_tickers_thread_for_september_17/hd77jdb/,15,wallstreetbets
GOD_of_FDs,t2_e5zkxo0y,"Imagine massively bagholding 500% IV 0dte IRNT calls praying that people stop dumping so you can escape with only a small loss.

""This is it, last time I stupidly gamble like this... I won't be a degen... dear God I'll be a changed man, boomer tickers for me from now on.""

You're definitely gonna have IRNT them losses boy.",1631882073,hd77joj,t3_ppx8r0,/r/wallstreetbets/comments/ppx8r0/daily_popular_tickers_thread_for_september_17/hd77joj/,-16,wallstreetbets
ForestFyre,t2_rh5g0,🤞🏻,1631882074,hd77jqx,t1_hd778lp,/r/wallstreetbets/comments/ppx8ia/daily_discussion_thread_for_september_17_2021/hd77jqx/,1,wallstreetbets
[deleted],,[removed],1631882076,hd77jy8,t1_hd7735w,/r/wallstreetbets/comments/ppx8ia/daily_discussion_thread_for_september_17_2021/hd77jy8/,1,wallstreetbets
obeseoranges,t2_uulu1hu,Which should i yolo SDC or TMC?,1631882079,hd77k5a,t3_ppx8r0,/r/wallstreetbets/comments/ppx8r0/daily_popular_tickers_thread_for_september_17/hd77k5a/,1,wallstreetbets
Hernand27,t2_a0zwfb51,SDC and BODY… just wait for opening,1631882079,hd77k5n,t3_ppx8ia,/r/wallstreetbets/comments/ppx8ia/daily_discussion_thread_for_september_17_2021/hd77k5n/,11,wallstreetbets
[deleted],,[removed],1631882080,hd77k74,t1_hd77i6z,/r/wallstreetbets/comments/ppx8r0/daily_popular_tickers_thread_for_september_17/hd77k74/,1,wallstreetbets
magnum_dong_opus,t2_bz95y5us,#SDC is going to 78,1631882084,hd77khf,t3_ppx8ia,/r/wallstreetbets/comments/ppx8ia/daily_discussion_thread_for_september_17_2021/hd77khf/,12,wallstreetbets
TopBuyer777,t2_a0dcmus2,PLTR 29 about to print on its way to $30,1631882088,hd77kqw,t3_ppx8ia,/r/wallstreetbets/comments/ppx8ia/daily_discussion_thread_for_september_17_2021/hd77kqw/,5,wallstreetbets
vaxul,t2_pxn04,The launch all depends on how many calls the the original sellers were able to buy back. We'll find out in 8 hours!,1631882091,hd77kw6,t1_hd76fdy,/r/wallstreetbets/comments/ppx8r0/daily_popular_tickers_thread_for_september_17/hd77kw6/,1,wallstreetbets
YoloTraderXXX,t2_8i41btlh,"The trick to being a millionaire, is to start with a million dollars.",1631882093,hd77l0f,t3_ppyykx,/r/wallstreetbets/comments/ppyykx/profit_baby/hd77l0f/,5,wallstreetbets
I_love_boobs86,t2_3sp5svj6,"I don’t think my calls on IRNT, OPAD, and TMC expiring today are gonna print guys",1631882099,hd77ldl,t3_ppx8r0,/r/wallstreetbets/comments/ppx8r0/daily_popular_tickers_thread_for_september_17/hd77ldl/,15,wallstreetbets
magnum_dong_opus,t2_bz95y5us,#did you bot SDC 78?,1631882102,hd77lk7,t1_hd77gtx,/r/wallstreetbets/comments/ppx8ia/daily_discussion_thread_for_september_17_2021/hd77lk7/,-1,wallstreetbets
showandblowyourload,t2_ijuhelv,LMAO I read that as IRNT-T😂,1631882104,hd77lqa,t1_hd75kd7,/r/wallstreetbets/comments/ppx8r0/daily_popular_tickers_thread_for_september_17/hd77lqa/,4,wallstreetbets
Laxman259,t2_7vfc3,China doesn’t have jurisdiction over the US exchanges,1631795500,hd2kdy9,t1_hd2hlbt,/r/wallstreetbets/comments/ppb6b6/best_way_to_bet_against_us_money_in_china/hd2kdy9/,6,wallstreetbets
throwawaydonaldinho,t2_4f30i26q,AH low is 12.54,1631795500,hd2kdyu,t1_hd2j6au,/r/wallstreetbets/comments/ppb0k0/daily_popular_tickers_thread_for_september_16/hd2kdyu/,1,wallstreetbets
6Lettah,t2_7e1r3sx7,"That sounds like something I would do!
I’m in this morning at $49…😳",1631795501,hd2ke2g,t1_hd1rms1,/r/wallstreetbets/comments/pp1ojw/irnt_yolo_21k_wont_be_able_to_sleep_tonight_share/hd2ke2g/,3,wallstreetbets
Butholxplorer_69_420,t2_56n6mshc,"Nice I have those calls too. What's your gameplay with them? Mine should open plus 400% and I kinda wanna sell right then, maybe rebuy on the dip I'm expecting over the first hour",1631795505,hd2ke9y,t1_hd2ju4n,/r/wallstreetbets/comments/ppb0k0/daily_popular_tickers_thread_for_september_16/hd2ke9y/,3,wallstreetbets
givemeyoushoes,t2_bmvw570,i like how you think,1631795505,hd2kear,t1_hd2k76r,/r/wallstreetbets/comments/ppb0k0/daily_popular_tickers_thread_for_september_16/hd2kear/,2,wallstreetbets
jawnyjawn,t2_encun,Pooping and unemployment numbers. Name a more iconic duo.,1631795506,hd2kedt,t3_ppab5b,/r/wallstreetbets/comments/ppab5b/daily_discussion_thread_for_september_16_2021/hd2kedt/,11,wallstreetbets
BrokeDayTrader,t2_2btqbtbv,"For the past week we’ve been opening green but dumping red by 10am, reverse trend or are bul just fuk

Edit: Nevermind just checked futures after jobs data ayyy bear r fuk",1631795509,hd2kekp,t3_ppab5b,/r/wallstreetbets/comments/ppab5b/daily_discussion_thread_for_september_16_2021/hd2kekp/,0,wallstreetbets
TopTech58,t2_ava5il2w,I’m at a 3 bag now hoping for ten,1631795511,hd2keov,t1_hd2jtqh,/r/wallstreetbets/comments/ppb0k0/daily_popular_tickers_thread_for_september_16/hd2keov/,2,wallstreetbets
[deleted],,[removed],1631795512,hd2ker7,t3_pola4w,/r/wallstreetbets/comments/pola4w/i_just_felt_like_running_that_is_all_i_have_to/hd2ker7/,1,wallstreetbets
isellgoodqualitygood,t2_h61wd8z,I have An iPhone and mine is green &amp; not a PA,1631795513,hd2ket3,t1_hd2dyyn,/r/wallstreetbets/comments/pp7a97/i_went_all_in_36000_on_amzn_3410_call_sept_17/hd2ket3/,1,wallstreetbets
